{
  "$schema": "https://agentworldprotocol.com/schemas/v0.1/session-ready.schema.json",
  "session_id": "sess_7f",
  "session_token": "st_9f2a7c1e4b8d6f03",
  "reconnect_window_ms": 30000,
  "heartbeat_interval_ms": 5000,
  "granted": {
    "channels": [
      { "channel": "rgb_wrist", "rate_hz": 15, "channel_id": 1 },
      { "channel": "proprio", "rate_hz": 100, "channel_id": 2 }
    ],
    "action_types": ["move_to_pose", "gripper_set", "stop"],
    "admin": [],
    "envelopes": [
      {
        "embodiment": "arm_01",
        "spatial": { "frame": "base", "aabb_m": [[-0.8, -0.8, 0.0], [0.8, 0.8, 1.2]] },
        "max_velocity_mps": 1.0,
        "max_force_n": 40,
        "max_action_rate_hz": 10,
        "enforcement": "both",
        "on_violation": "clamp"
      }
    ]
  },
  "stream_endpoints": [
    { "binding": "webtransport", "url": "https://127.0.0.1:8711/stream", "channels": [1, 2] },
    { "binding": "ws", "url": "ws://127.0.0.1:8710/stream", "channels": [1, 2] },
    { "binding": "inline" }
  ],
  "frame_tree": {
    "frames": [
      { "id": "world", "parent": null },
      { "id": "base", "parent": "world", "transform": { "p_m": [0, 0, 0.75], "q": [0, 0, 0, 1] } },
      { "id": "arm_01_ee", "parent": "base", "dynamic": true },
      { "id": "cam_wrist", "parent": "arm_01_ee", "transform": { "p_m": [0, 0, 0.05], "q": [0, 0, 0, 1] } }
    ]
  },
  "clock_anchor": "2026-08-22T18:00:00Z"
}
